{
    "$schema": "http://json-schema.org/draft-07/schema#",
    "$id": "https://uxbench.dev/schema/benchmark/1.0",
    "title": "UX Benchmark Report",
    "type": "object",
    "required": ["schema_version", "source", "metadata", "metrics"],
    "properties": {
        "schema_version": {
            "type": "string",
            "const": "1.0"
        },
        "source": {
            "type": "string",
            "enum": ["chrome-extension", "playwright-mode1", "playwright-mode2", "custom"]
        },
        "metadata": {
            "type": "object",
            "required": ["recording_name", "product", "task", "timestamp"],
            "properties": {
                "recording_name": {
                    "type": "string"
                },
                "product": {
                    "type": "string"
                },
                "task": {
                    "type": "string"
                },
                "url": {
                    "type": "string",
                    "format": "uri"
                },
                "urls_visited": {
                    "type": "array",
                    "items": {
                        "type": "string"
                    }
                },
                "timestamp": {
                    "type": "string",
                    "format": "date-time"
                },
                "duration_ms": {
                    "type": "integer",
                    "minimum": 0
                },
                "browser": {
                    "type": "string"
                },
                "source_version": {
                    "type": "string"
                },
                "operator": {
                    "type": "string",
                    "enum": ["human", "ai-agent", "script"]
                },
                "persona": {
                    "type": ["string", "null"]
                },
                "agent_model": {
                    "type": ["string", "null"]
                },
                "navigation_count": {
                    "type": "integer"
                },
                "navigation_gap_ms": {
                    "type": "integer"
                }
            }
        },
        "metrics": {
            "type": "object",
            "properties": {
                "click_count": {
                    "type": "object",
                    "properties": {
                        "total": {
                            "type": "integer",
                            "minimum": 0
                        },
                        "productive": {
                            "type": "integer",
                            "minimum": 0
                        },
                        "ceremonial": {
                            "type": "integer",
                            "minimum": 0
                        },
                        "wasted": {
                            "type": "integer",
                            "minimum": 0
                        },
                        "ceremonial_details": {
                            "type": "array",
                            "description": "What each ceremonial click was — e.g. 'dismiss cookie banner', 'close confirmation dialog'",
                            "items": {
                                "type": "object",
                                "properties": {
                                    "element": {
                                        "type": "string"
                                    },
                                    "reason": {
                                        "type": "string"
                                    }
                                }
                            }
                        },
                        "wasted_details": {
                            "type": "array",
                            "description": "What each wasted click was — e.g. 'clicked disabled Submit button'",
                            "items": {
                                "type": "object",
                                "properties": {
                                    "element": {
                                        "type": "string"
                                    },
                                    "reason": {
                                        "type": "string"
                                    }
                                }
                            }
                        }
                    }
                },
                "time_on_task": {
                    "type": "object",
                    "properties": {
                        "total_ms": {
                            "type": "integer",
                            "minimum": 0
                        },
                        "active_ms": {
                            "type": ["integer", "null"]
                        },
                        "idle_ms": {
                            "type": ["integer", "null"]
                        },
                        "longest_idle_ms": {
                            "type": ["integer", "null"]
                        },
                        "longest_idle_after": {
                            "type": ["string", "null"],
                            "description": "What happened before the longest idle gap — e.g. 'opened filter panel'"
                        },
                        "idle_gaps": {
                            "type": ["array", "null"],
                            "description": "Idle gaps > threshold (default 3s), each with context",
                            "items": {
                                "type": "object",
                                "properties": {
                                    "gap_ms": {
                                        "type": "number"
                                    },
                                    "after_action": {
                                        "type": "string"
                                    },
                                    "before_action": {
                                        "type": "string"
                                    }
                                }
                            }
                        }
                    }
                },
                "fitts": {
                    "type": "object",
                    "properties": {
                        "formula": {
                            "type": "string",
                            "const": "shannon"
                        },
                        "cumulative_id": {
                            "type": "number",
                            "minimum": 0
                        },
                        "average_id": {
                            "type": "number",
                            "minimum": 0
                        },
                        "max_id": {
                            "type": "number",
                            "minimum": 0
                        },
                        "max_id_element": {
                            "type": "string",
                            "description": "The element that was hardest to reach — e.g. 'Save button'"
                        },
                        "max_id_distance_px": {
                            "type": "number",
                            "description": "How far the cursor traveled to reach it"
                        },
                        "max_id_target_size": {
                            "type": "string",
                            "description": "Target dimensions — e.g. '80×32px'"
                        },
                        "top_3_hardest": {
                            "type": ["array", "null"],
                            "description": "Three hardest targeting actions with element names and IDs",
                            "items": {
                                "type": "object",
                                "properties": {
                                    "element": {
                                        "type": "string"
                                    },
                                    "id": {
                                        "type": "number"
                                    },
                                    "distance_px": {
                                        "type": "number"
                                    },
                                    "target_size": {
                                        "type": "string"
                                    }
                                }
                            }
                        },
                        "throughput": {
                            "type": ["object", "null"],
                            "properties": {
                                "a_ms": {
                                    "type": "number"
                                },
                                "b_ms_per_bit": {
                                    "type": "number"
                                },
                                "r_squared": {
                                    "type": "number"
                                }
                            }
                        },
                        "average_path_efficiency": {
                            "type": ["number", "null"]
                        },
                        "total_overshoots": {
                            "type": ["integer", "null"]
                        }
                    }
                },
                "context_switches": {
                    "type": "object",
                    "properties": {
                        "total": {
                            "type": "integer",
                            "minimum": 0
                        },
                        "ratio": {
                            "type": "number"
                        },
                        "longest_keyboard_streak": {
                            "type": ["integer", "null"]
                        },
                        "longest_mouse_streak": {
                            "type": ["integer", "null"]
                        },
                        "most_switch_heavy_moment": {
                            "type": ["string", "null"],
                            "description": "Where rapid switching happened — e.g. 'filling form then clicking dropdowns'"
                        }
                    }
                },
                "shortcut_coverage": {
                    "type": "object",
                    "description": "Keyboard shortcut usage — any modifier combo (Ctrl/Cmd/Alt + key) counts as a shortcut",
                    "properties": {
                        "shortcuts_used": {
                            "type": "integer",
                            "description": "Number of modifier-key combos used during the session"
                        }
                    }
                },
                "typing_ratio": {
                    "type": "object",
                    "properties": {
                        "free_text_inputs": {
                            "type": "integer"
                        },
                        "constrained_inputs": {
                            "type": "integer"
                        },
                        "ratio": {
                            "type": "number"
                        },
                        "free_text_fields": {
                            "type": ["array", "null"],
                            "description": "Which fields required typing — e.g. ['Customer name', 'Notes']",
                            "items": {
                                "type": "string"
                            }
                        }
                    }
                },
                "scanning_distance": {
                    "type": "object",
                    "properties": {
                        "method": {
                            "type": "string"
                        },
                        "cumulative_px": {
                            "type": "number",
                            "minimum": 0
                        },
                        "average_px": {
                            "type": "number",
                            "minimum": 0
                        },
                        "max_single_px": {
                            "type": "number",
                            "minimum": 0
                        },
                        "max_single_from": {
                            "type": ["string", "null"],
                            "description": "Where the user was — e.g. 'data table row 3'"
                        },
                        "max_single_to": {
                            "type": ["string", "null"],
                            "description": "Where they jumped to — e.g. 'toolbar Save button'"
                        }
                    }
                },
                "scroll_distance": {
                    "type": "object",
                    "properties": {
                        "total_px": {
                            "type": "number",
                            "minimum": 0
                        },
                        "page_scroll_px": {
                            "type": ["number", "null"]
                        },
                        "container_scroll_px": {
                            "type": ["number", "null"]
                        },
                        "scroll_events": {
                            "type": ["integer", "null"]
                        },
                        "heaviest_container": {
                            "type": ["string", "null"],
                            "description": "Which container demanded the most scrolling — e.g. 'customer list sidebar'"
                        }
                    }
                },
                "mouse_travel": {
                    "type": "object",
                    "description": "Total cursor travel distance — raw motor cost of moving the mouse across the session",
                    "properties": {
                        "total_px": {
                            "type": "number",
                            "minimum": 0,
                            "description": "Cumulative pixel distance the cursor traveled"
                        },
                        "idle_travel_px": {
                            "type": "number",
                            "minimum": 0,
                            "description": "Cursor travel that did not end in a click — hunting, exploring, overshooting"
                        },
                        "move_events": {
                            "type": "integer",
                            "minimum": 0,
                            "description": "Number of sampled movement frames"
                        },
                        "path_efficiency": {
                            "type": ["number", "null"],
                            "description": "Ratio of straight-line scanning distance to actual cursor travel (1.0 = perfectly efficient, lower = more wasted movement)"
                        }
                    }
                }
            }
        },
        "human_signals": {
            "type": ["object", "null"],
            "description": "Present only for chrome-extension recordings",
            "properties": {
                "decision_time": {
                    "type": "object",
                    "properties": {
                        "mean_ms": {
                            "type": "number"
                        },
                        "median_ms": {
                            "type": "number"
                        },
                        "p90_ms": {
                            "type": "number"
                        },
                        "idle_gaps": {
                            "type": "integer"
                        },
                        "worst_idle": {
                            "type": ["object", "null"],
                            "properties": {
                                "gap_ms": {
                                    "type": "number"
                                },
                                "after_action": {
                                    "type": "string"
                                },
                                "likely_cause": {
                                    "type": "string"
                                }
                            }
                        }
                    }
                },
                "hesitation": {
                    "type": "object",
                    "properties": {
                        "hover_hesitations": {
                            "type": "integer"
                        },
                        "near_miss_corrections": {
                            "type": "integer"
                        },
                        "repeated_targeting": {
                            "type": "integer"
                        }
                    }
                },
                "throughput_index": {
                    "type": "object",
                    "properties": {
                        "b_coefficient_ms_per_bit": {
                            "type": "number"
                        },
                        "comparison_to_norm": {
                            "type": "string"
                        }
                    }
                }
            }
        },
        "action_log": {
            "type": ["array", "null"],
            "description": "Optional per-action detail emitted by the recorder."
        }
    }
}
