{
    "schema_version": "1.0",
    "source": "chrome-extension",
    "metadata": {
        "recording_name": "Modern CRM Redesign",
        "product": "Modern CRM",
        "task": "Create New Customer",
        "url": "https://modern-crm.example.com/customers/new",
        "urls_visited": ["https://modern-crm.example.com/customers/new"],
        "timestamp": "2026-02-23T14:00:00Z",
        "duration_ms": 18500,
        "browser": "Chrome",
        "source_version": "1.0.0",
        "operator": "human",
        "navigation_count": 1,
        "navigation_gap_ms": 0
    },
    "metrics": {
        "click_count": {
            "total": 5,
            "productive": 5,
            "ceremonial": 0,
            "wasted": 0,
            "ceremonial_details": [],
            "wasted_details": []
        },
        "time_on_task": {
            "total_ms": 18500,
            "active_ms": 18500,
            "idle_ms": 0,
            "idle_gaps": []
        },
        "fitts": {
            "formula": "shannon",
            "cumulative_id": 15.3,
            "average_id": 2.1,
            "max_id": 2.8,
            "max_id_element": "Save",
            "max_id_distance_px": 260,
            "max_id_target_size": "120x40px",
            "top_3_hardest": [
                {
                    "element": "Save",
                    "id": 2.8,
                    "distance_px": 260,
                    "target_size": "120x40px"
                }
            ]
        },
        "context_switches": {
            "total": 2,
            "ratio": 0.05,
            "longest_keyboard_streak": 12,
            "longest_mouse_streak": 2
        },
        "shortcut_coverage": {
            "shortcuts_used": 1
        },
        "typing_ratio": {
            "free_text_inputs": 3,
            "constrained_inputs": 3,
            "ratio": 0.5,
            "free_text_fields": ["Name", "Email", "Notes"]
        },
        "scanning_distance": {
            "method": "euclidean",
            "cumulative_px": 4200,
            "average_px": 700,
            "max_single_px": 980,
            "max_single_from": "Email",
            "max_single_to": "Save"
        },
        "scroll_distance": {
            "total_px": 600,
            "page_scroll_px": 600,
            "container_scroll_px": 0,
            "total_horizontal_px": 0,
            "scroll_events": 4,
            "heaviest_container": null
        },
        "mouse_travel": {
            "total_px": 6100,
            "idle_travel_px": 700,
            "move_events": 120,
            "path_efficiency": 0.689
        }
    },
    "action_log": []
}
